[
    {
        "roll": {
            "min": 1,
            "max": 1
        },
        "result": "Famous Deed",
        "modifiers": {
            "glory": 3,
            "honor": 0,
            "status": 0
        },
        "other_effects": {
            "type": "starting item",
            "instructions": "Roll a ten-sided die again and add the resulting family heirloom to your starting items. You choose one quality and the GM chooses one quality from the list of item qualities, on page 240; these are applied to the item.",
            "outcomes": [
                {
                    "roll": {
                        "min": 1,
                        "max": 3
                    },
                    "outcome": "weapon"
                },
                {
                    "roll": {
                        "min": 4,
                        "max": 6
                    },
                    "outcome": "set of armor"
                },
                {
                    "roll": {
                        "min": 7,
                        "max": 8
                    },
                    "outcome": "another item"
                },
                {
                    "roll": {
                        "min": 9,
                        "max": 9
                    },
                    "outcome": "horse or other animal"
                },
                {
                    "roll": {
                        "min": 10,
                        "max": 10
                    },
                    "outcome": "boat or estate"
                }
            ]
        },
        "source": "Core"
    },
    {
        "roll": {
            "min": 2,
            "max": 2
        },
        "result": "Glorious Sacrifice",
        "modifiers": {
            "glory": 5,
            "honor": 5,
            "status": 0
        },
        "other_effects": {
            "type": "lost family heirloom",
            "instructions": "Roll a ten-sided die again to determin your lost family heirloom, which exists somewhere in the world. You choose one quality and the GM chooses one quality; these are applied to the item. You do not know where the heirloom is, but you could later reclaim it during the campaign.",
            "outcomes": [
                {
                    "roll": {
                        "min": 1,
                        "max": 3
                    },
                    "outcome": "weapon"
                },
                {
                    "roll": {
                        "min": 4,
                        "max": 6
                    },
                    "outcome": "set of armor"
                },
                {
                    "roll": {
                        "min": 7,
                        "max": 8
                    },
                    "outcome": "another item"
                },
                {
                    "roll": {
                        "min": 9,
                        "max": 9
                    },
                    "outcome": "horse or other animal"
                },
                {
                    "roll": {
                        "min": 10,
                        "max": 10
                    },
                    "outcome": "boat or estate"
                }
            ]
        },
        "source": "Core"
    },
    {
        "roll": {
            "min": 3,
            "max": 3
        },
        "result": "Wondrous Work",
        "modifiers": {
            "glory": 5,
            "honor": 0,
            "status": 0
        },
        "other_effects": {
            "type": "Artisan skills",
            "instructions": "Roll a ten-sided die again to determine an Artisan skill; gain +1 rank in that skill.",
            "outcomes": [
                {
                    "roll": {
                        "min": 1,
                        "max": 3
                    },
                    "outcome": "Aesthetics"
                },
                {
                    "roll": {
                        "min": 4,
                        "max": 6
                    },
                    "outcome": "Composition"
                },
                {
                    "roll": {
                        "min": 7,
                        "max": 8
                    },
                    "outcome": "Design"
                },
                {
                    "roll": {
                        "min": 9,
                        "max": 10
                    },
                    "outcome": "Smithing"
                }
            ]
        },
        "source": "Core"
    },
    {
        "roll": {
            "min": 4,
            "max": 4
        },
        "result": "Dynasty Builder",
        "modifiers": {
            "glory": -3,
            "honor": 0,
            "status": 0
        },
        "other_effects": {
            "type": "Social skill",
            "instructions": "Roll a ten-sided die again to determine a Social skill; gain +1 rank in that skill",
            "outcomes": [
                {
                    "roll": {
                        "min": 1,
                        "max": 3
                    },
                    "outcome": "Command"
                },
                {
                    "roll": {
                        "min": 4,
                        "max": 6
                    },
                    "outcome": "Courtesy"
                },
                {
                    "roll": {
                        "min": 7,
                        "max": 8
                    },
                    "outcome": "Games"
                },
                {
                    "roll": {
                        "min": 9,
                        "max": 10
                    },
                    "outcome": "Performance"
                }
            ]
        },
        "source": "Core"
    },
    {
        "roll": {
            "min": 5,
            "max": 5
        },
        "result": "Discovery",
        "modifiers": {
            "glory": 3,
            "honor": 0,
            "status": 0
        },
        "other_effects": {
            "type": "Scholar skill",
            "instructions": "Roll a ten-sided die again to determine a Scholar skill; gain +1 rank in that skill",
            "outcomes": [
                {
                    "roll": {
                        "min": 1,
                        "max": 3
                    },
                    "outcome": "Culture"
                },
                {
                    "roll": {
                        "min": 4,
                        "max": 5
                    },
                    "outcome": "Sentiment"
                },
                {
                    "roll": {
                        "min": 6,
                        "max": 7
                    },
                    "outcome": "Government"
                },
                {
                    "roll": {
                        "min": 8,
                        "max": 9
                    },
                    "outcome": "Medicine"
                },
                {
                    "roll": {
                        "min": 10,
                        "max": 10
                    },
                    "outcome": "Theology"
                }
            ]
        },
        "source": "Core"
    },
    {
        "roll": {
            "min": 6,
            "max": 6
        },
        "result": "Ruthless Victor",
        "modifiers": {
            "glory": 0,
            "honor": -5,
            "status": 0
        },
        "other_effects": {
            "type": "Martial skill",
            "instructions": "Roll a ten-sided again to determine a Martial skill; gain +1 rank in that skill",
            "outcomes": [
                {
                    "roll": {
                        "min": 1,
                        "max": 3
                    },
                    "outcome": "Fitness"
                },
                {
                    "roll": {
                        "min": 4,
                        "max": 5
                    },
                    "outcome": "Martial Arts [Melee]"
                },
                {
                    "roll": {
                        "min": 6,
                        "max": 7
                    },
                    "outcome": "Martial Arts [Ranged]"
                },
                {
                    "roll": {
                        "min": 8,
                        "max": 8
                    },
                    "outcome": "Martial Arts [Unarmed]"
                },
                {
                    "roll": {
                        "min": 9,
                        "max": 9
                    },
                    "outcome": "Tactics"
                },
                {
                    "roll": {
                        "min": 10,
                        "max": 10
                    },
                    "outcome": "Meditation"
                }
            ]
        },
        "source": "Core"
    },
    {
        "roll": {
            "min": 7,
            "max": 7
        },
        "result": "Elevated for Service",
        "modifiers": {
            "glory": -3,
            "honor": 3,
            "status": 0
        },
        "other_effects": {
            "type": "Trade skill",
            "instructions": "Roll a ten-sided die again to determine a Trade skill; gain +1 rank in that skill",
            "outcomes": [
                {
                    "roll": {
                        "min": 1,
                        "max": 3
                    },
                    "outcome": "Commerce"
                },
                {
                    "roll": {
                        "min": 4,
                        "max": 5
                    },
                    "outcome": "Labor"
                },
                {
                    "roll": {